{
  "id": "8d2ac382-0a89-436a-903f-1cad8470b1e6",
  "version": "0.0.2",
  "storage": {
    "protocol": "gcs",
    "location": "https://drive.google.com/file/d/1d7UvpmYyCVK4mci8ZRnr2M6LCLR3xTud",
    "integrity_proof": "ni:///sha-256;R5EiPS2gTn8KeXwvjXAcHqsWq4uxlOj4OnhpC7gTvZY"
  },
  "identity": {
    "org": "Codex Forge",
    "process": "AI-Summarized-Web-Page",
    "artifact": "web-content.txt",
    "subject": "AI Summary: Join a hackathon \nHost a hackathon \nResources \n1\nÂ \nNotifications\n\nLoading...\n\nOverview\nMy projects\nP..."
  },
  "anchor": {
    "chain": "google:drive",
    "tx": "1roR433gwWNhpIAY8dgK-3cKRcAg3yxzv",
    "url": "https://drive.google.com/file/d/1roR433gwWNhpIAY8dgK-3cKRcAg3yxzv/view?usp=drivesdk",
    "hash_alg": "sha-256",
    "timestamp": "2025-10-21T02:51:27.080Z"
  },
  "signatures": [
    {
      "alg": "ES256",
      "kid": "jwk:eyJjcnYiOiJQLTI1NiIsImV4dCI6dHJ1ZSwia2V5X29wcyI6WyJ2ZXJpZnkiXSwia3R5IjoiRUMiLCJ4IjoiWWdERUJCVF84NW9TZk1iMWN3a3ZwTVFVcDFKc3NwdEstMXBuc2NNTkZ5QSIsInkiOiJscU1Hb1pHTE9Rcm1OREN6cldvb0VOZjh0R2FKT3RvZ3FRUlFyN2RfT3FRIn0",
      "signature": "AARMvrYxpTFs0BMJgIew_2TImpgYE7eMLvCXBNCDxC19UHsM4DW-1MhQq4zdZzlDIfBQdui3sVp8f4oeDbOWZw"
    }
  ]
}
